{
  "$schema": "http://json-schema.org/draft-07/schema#",
  "title": "Luwak DICOM Anonymizer Configuration",
  "description": "Configuration schema for the Luwak DICOM anonymization pipeline.",
  "type": "object",
  "properties": {
    "inputFolder": {
      "type": "string",
      "description": "Source directory or file for DICOM files to be anonymized.",
      "default": "./inputs",
      "examples": ["/data/dicom", "input/file.dcm"]
    },
    "outputDeidentifiedFolder": {
      "type": "string",
      "description": "Destination directory for anonymized DICOM files.",
      "default": "./deidentified",
      "examples": ["./deidentified"]
    },
    "outputPrivateMappingFolder": {
      "type": "string",
      "description": "Destination directory for UID mappings and metadata exports.",
      "default": "./private",
      "examples": ["./private"]
    },
    "recipesFolder": {
      "type": "string",
      "description": "Directory containing deid recipe files.",
      "default": "./recipes",
      "examples": ["./recipes"]
    },
    "recipes": {
      "oneOf": [
        {"type": "string"},
        {"type": "array", "items": {"type": "string"}}
      ],
      "description": "List or single string of recipe names to apply. Can be built-in or custom recipe files.",
      "default": "deid.dicom",
      "examples": ["deid.dicom", ["deid.dicom.basic-profile", "deid.dicom.safe-private-tags"]]
    },
    "projectHashRoot": {
      "type": "string",
      "description": "Salt for deterministic UID generation and date shifting.",
      "default": "myproject2025",
      "examples": ["myproject2025"]
    },
    "patientIdPrefix": {
      "type": "string",
      "description": "Prefix for sequential patient IDs (e.g., 'Zenta' generates 'Zenta00', 'Zenta01', etc.).",
      "default": "Patient",
      "examples": ["Patient", "Anonymous"]
    },
    "maxDateShiftDays": {
      "type": "integer",
      "description": "Maximum number of days for date shifting (default 1095).",
      "default": 1095,
      "minimum": 0,
      "examples": [365, 1095]
    },
    "excludedTagsFromParquet": {
      "type": "array",
      "description": "List of DICOM tags to exclude from Parquet export. Accepts integer or string formats (e.g., 2145386512, '7FE0,0010', '(7FE0,0010)').",
      "items": {
        "oneOf": [
          {"type": "integer"},
          {"type": "string"}
        ]
      },
      "default": ["(7FE0,0010)"],
      "examples": [[2145386512, "7FE0,0010", "(7FE0,0010)"]]
    },
    "logLevel": {
      "type": "string",
      "description": "Logging level for the anonymization process.",
      "enum": ["PRIVATE", "DEBUG", "INFO", "WARNING", "ERROR"],
      "default": "INFO",
      "examples": ["DEBUG", "INFO", "WARNING"]
    },
    "cleanDescriptorsLlmBaseUrl": {
      "type": "string",
      "description": "Base URL of the OpenAI-compatible LLM to be used for cleaning descriptors. If not specified then CLEAN_DESCRIPTORS_LLM_BASE_URL environment variable content is used.",
      "default": "",
      "examples": ["http://localhost:1234/v1", "https://api.openai.com/v1"]
    },
    "cleanDescriptorsLlmModel": {
      "type": "string",
      "description": "LLM model name to be used for cleaning descriptors. If not specified then CLEAN_DESCRIPTORS_LLM_MODEL environment variable content is used.",
      "default": "",
      "examples": ["openai/gpt-oss-20b", "gpt-4o-mini"]
    },
    "cleanDescriptorsLlmApiKey": {
      "type": "string",
      "description": "API key to be used for the LLM for cleaning descriptors. If not specified then value of environment variable specified in cleanDescriptorsLlmApiKeyEnvVar is used.",
      "default": ""
    },
    "cleanDescriptorsLlmApiKeyEnvVar": {
      "type": "string",
      "description": "Name of the environment variable that stores API key for CleanDescriptorsLlm. Deprecated. Use CLEAN_DESCRIPTORS_LLM_API_KEY environment variable instead.",
      "default": "CLEAN_DESCRIPTORS_LLM_API_KEY"
    },
    "cleanDescriptorsHttpHeaders": {
      "type": "object",
      "description": "Additional HTTP headers to include in requests to the LLM for cleaning descriptors. Should be a JSON object where keys are header names and values are header values. If not specified then CLEAN_DESCRIPTORS_LLM_HTTP_HEADERS environment variable content is used.",
      "default": {},
      "examples": [{"Authorization": "Bearer mytoken"}, {"CF-Access-Client-Id": "someid", "CF-Access-Client-Secret": "mysecret"}]
    },
    "analysisCacheFolder": {
      "type": "string",
      "description": "Path to folder for analysis cache databases (patient_uid.db and llm_cache.db).\nIf specified and folder exists with databases, they will be loaded and updated; if not, new databases will be created.\nDatabases persist across anonymization runs to ensure consistent mappings.\nIf not specified, temporary databases are created in the private mapping folder and deleted after processing.",
      "examples": ["./analysis_cache", "/var/data/luwak/cache"]
    },
    "physicalFacePixelationSizeMm": {
      "type": "number",
      "description": "Target block size in millimeters for face pixelation during defacing. Controls the resolution of pixelation blocks, with larger values providing stronger anonymization. Default 8.5mm works well across different resolutions.",
      "default": 8.5,
      "minimum": 1.0,
      "examples": [8.5, 10.0, 5.0]
    },
    "faceDilationMarginMm": {
      "type": "number",
      "description": "Margin in millimeters by which the face mask is dilated before pixelation. A larger margin grows the anonymized region outward, tolerating segmentation under-coverage at the cost of pixelating more surrounding tissue. Set to 0 to disable dilation.",
      "default": 15.0,
      "minimum": 0.0,
      "examples": [15.0, 3.0, 0.0]
    },
    "selectedModalities": {
      "type": "array",
      "description": "List of DICOM modalities to include in processing. If empty or not set, all modalities are included.",
      "items": {"type": "string"},
      "default": [],
      "examples": [["MR", "CT"]]
    },
    "keepTempFiles": {
      "type": "boolean",
      "description": "If true, temporary directories created during processing (temp_organized_input, temp_defaced_organized) are retained after the workflow completes. Useful for step-by-step validation of the deidentification pipeline.",
      "default": false
    },
    "testOptions": {
      "type": "object",
      "description": "Options for testing, including mask defacer paths.",
      "default": {},
      "properties": {
        "useExistingMaskDefacer": {
          "type": "array",
          "description": "List of file paths for mask defacer.",
          "items": {"type": "string"},
          "default": [],
          "examples": ["/path/to/mask1.nii.gz", "/path/to/mask2.nii.gz"]
        }
      },
      "additionalProperties": false
    },
    "customTags": {
      "type": "object",
      "description": "Paths to manually revised tag CSV files for standard and private tags.",
      "properties": {
        "standard": {
          "type": "string",
          "description": "Path to the manually revised standard tags CSV file.",
          "examples": ["./data/standard_tags.csv", "/path/to/custom/standard_tags.csv"]
        },
        "private": {
          "type": "string",
          "description": "Path to the manually revised private tags CSV file.",
          "examples": ["./data/private_tags.csv", "/path/to/custom/private_tags.csv"]
        }
      }
    },
    "bypassCleanDescriptorsLlm": {
      "type": "boolean",
      "description": "If true, bypasses the LLM call in clean_descriptors_with_llm. The result is always treated as 0 (no PHI detected) and the tag is kept unchanged.",
      "default": false
    },
    "bypassCleanPixelData": {
      "type": "boolean",
      "description": "If true, skips the CleanPixelDataService execution when the clean_pixel_data recipe is active. Use this when burned-in pixel data has been verified absent by other means (e.g. manual review). The DICOM CID 7050 code 113101 (Clean Pixel Data Option) is still injected into DeidentificationMethodCodeSequence as if cleaning had been performed.",
      "default": false
    },
    "cleanPreamble": {
      "type": "boolean",
      "description": "If true (default), blanks the 128-byte DICOM file preamble (ds.preamble) of every anonymized file by overwriting it with null bytes. The preamble is not governed by any DICOM tag and is therefore not cleaned by deid automatically; it may contain PHI or identifying text in some equipment implementations.",
      "default": true
    },
    "saveDefaceMasks": {
      "type": "boolean",
      "description": "When true, the ML-generated face mask is saved as a compressed NRRD file in the private mapping folder for every series that runs ML inference, and the mask database persists after the run for re-run cache hits.\nWhen false or absent, a temporary mask database is still created during the run to support PET/CT mask projection (the CT mask is resampled onto the paired PET), but both the database and all mask files are deleted at the end of the run.",
      "default": false,
      "examples": [true, false]
    },
    "numWorkers": {
      "type": "integer",
      "description": "Number of parallel workers for DICOM processing. Default 1 (sequential).",
      "default": 1,
      "minimum": 1,
      "examples": [1, 4, 8]
    },
    "verifyDefacingIntegrity": {
      "type": "boolean",
      "description": "When true, after defacing each series the pipeline reads the written DICOM files back from disk and verifies that no voxel outside the (dilated) face mask was modified. The face mask is dilated by the pixelation block size to tolerate block-boundary effects. A WARNING is logged for each series that fails the check; processing continues regardless. Useful for quality-assurance runs; leave false (default) in production to avoid the extra I/O overhead.",
      "default": false,
      "examples": [true, false]
    }
  },
  "required": [
    "inputFolder",
    "outputDeidentifiedFolder",
    "outputPrivateMappingFolder",
    "recipesFolder",
    "recipes"
  ],
  "additionalProperties": false
}

