{
  "inputFolder": "./inputs",
  "outputDeidentifiedFolder": "./output/deidentified",
  "outputPrivateMappingFolder": "./output/privateMapping",
  "recipesFolder": "./output/recipes",
  "recipes": ["basic_profile", "retain_safe_private_tags", "clean_recognizable_visual_features"],
  "maxDateShiftDays": 1095,
  "excludedTagsFromParquet":  ["(7FE0,0010)"],
  "projectHashRoot": "7f4fsui293asdf",
  "cleanDescriptorsLlmBaseUrl": "https://api.openai.com/v1",
  "cleanDescriptorsLlmModel": "gpt-4o-mini",
  "cleanDescriptorsLlmApiKeyEnvVar": "ZENTA_OPENAI_API_KEY"
}